{"action":"chat.completions","agent_id":"billing-agent","agent_ts":"2026-06-15T10:00:00.000Z","agent_version":"1.4.2","canon_version":"rcp-1","causal_prev_hashes":[],"content_hash":"sha256:652244a75682c836d37423dd81172eeeeded649808995785382236fac482ffb8","cost_micros_usd":18000,"display_seq":0,"domain":"flightrecorder.record.v2","event_type":"llm_call","framework":"openai-agents","key":{"key_epoch":7,"key_status":"active","key_valid_from":"2026-06-01T00:00:00.000Z","signing_key_id":"key-2026-06"},"observed_via":"proxy","parent_span_id":null,"project_id":"22222222-2222-2222-2222-222222222222","received_ts":"2026-06-15T10:00:00.123Z","record_id":"11111111-1111-1111-1111-111111111111","schema_version":"2","session_id":"33333333-3333-3333-3333-333333333333","sig":"ed25519:hUSXxW3yFot4FyLMQnvS53PNLTGRlS2TtnTS-Pl6Q37eEqTNd16V1XvoYreMfbN6tgdHEWiK8jzLtg7Qd3SYAA","span_id":"span-0001","status":"ok","tokens":{"in":1200,"out":300}}